{
  "Address" : "Mountain View" ,
  "Age" : 23 ,
  "AmountDue" : 200.23 ,
  "CustomerCode@odata.type" : "Edm.Guid" ,
  "CustomerCode" : "c9da6455-213d-42c9-9a79-3e9149a57833" ,
  "CustomerSince@odata.type" : "Edm.DateTime" ,
  "CustomerSince" : "2008-07-10T00:00:00" ,
  "IsActive" : true ,
  "NumberOfOrders@odata.type" : "Edm.Int64" ,
  "NumberOfOrders" : "255" ,
  "PartitionKey" : "mypartitionkey" ,
  "RowKey" : "myrowkey"
}